lesson_id,filename,script_text,voice_direction
feedback,encourage-1,"Let's try another one!","Say this in a cheerful, motivating tone like a supportive teacher. Make it sound fun and exciting to keep going:"
feedback,encourage-2,"Let's keep going!","Say this in an upbeat, encouraging tone like a supportive teacher cheering the child on:"
feedback,encourage-3,"You've got the next one!","Say this in a confident, warm tone like a supportive teacher who believes in the child:"
feedback,encourage-4,"On to the next one!","Say this in a bright, energetic tone like a supportive teacher. Make it feel like an adventure:"
feedback,encourage-5,"Ready for the next one?","Say this in a playful, curious tone like a supportive teacher. Sound excited about what's coming:"
feedback,encourage-6,"Let's try again!","Say this in a warm, motivating tone like a supportive teacher. Make trying again feel like a positive thing:"
