"lesson_id","filename","script_text","voice_direction"
"lessons/RF.3.4a","S1a","Great readers know why they are reading.",""
"lessons/RF.3.4a","S2a","Different goals need different books. Stories for fun. Facts for learning.",""
"lessons/RF.3.4a","S3a","Set a specific goal. I want to find five facts about dolphins!",""
"lessons/RF.3.4a","S4a","Here is a helpful trick.",""
"lessons/RF.3.4a","S4b","Before you start, ask: what do I want from this book?",""
"lessons/RF.3.4a","S4c","Now you are ready to read with purpose!",""
