"lesson_id","filename","script_text","voice_direction"
"lessons/RI.4.8","S1a","Authors give reasons for their points. Strong writers also give evidence.",""
"lessons/RI.4.8","S2a","A reason is the why behind the point.",""
"lessons/RI.4.8","S3a","Evidence is proof. Facts. Examples. Statistics.",""
"lessons/RI.4.8","S4a","Here is a helpful trick.",""
"lessons/RI.4.8","S4b","Highlight reasons one color and evidence another. See how they connect!",""
"lessons/RI.4.8","S4c","Now you are ready to spot reasons and evidence!",""
