"lesson_id","filename","script_text","voice_direction"
"lessons/L.3.5","S1a","Some words mean more than what they say.",""
"lessons/L.3.5","S1b","Figurative language paints a picture or feeling.",""
"lessons/L.3.5","S2a","Simile uses like or as. He ran like a cheetah.",""
"lessons/L.3.5","S2b","Metaphor says something is something else. Her smile is sunshine.",""
"lessons/L.3.5","S3a","Idioms have hidden meanings. Piece of cake means easy!",""
"lessons/L.3.5","S4a","Here is a helpful trick.",""
"lessons/L.3.5","S4b","When words sound weird literally, look for a hidden meaning!",""
"lessons/L.3.5","S4c","Now you are ready for words with hidden meanings!",""
