lesson_id,filename,script_text,voice_direction
kindergarten/RF.K.2e,RF.K.2e-Q1,"Start with Cat. Change the kuh sound to the buh sound. What word do you get? Sat, Bat, Mat, or Hat? What do you think?","Warm calm kindergarten teacher voice. Natural pacing. Brief pause between each answer choice."
kindergarten/RF.K.2e,RF.K.2e-Q2,"Start with Hop. Change the huh sound to the tuh sound. What word do you get? Top, Pop, Cop, or Mop? What do you think?","Warm calm kindergarten teacher voice. Natural pacing. Brief pause between each answer choice."
kindergarten/RF.K.2e,RF.K.2e-Q3,"Start with Man. Change the letter A to the letter E. What word do you get? Mun, Mon, Min, or Men? What do you think?","Warm calm kindergarten teacher voice. Natural pacing. Brief pause between each answer choice."
kindergarten/RF.K.2e,RF.K.2e-Q4,"Start with the word Sit. Change the tuh sound to the puh sound. What word do you get? Sip, Set, Sat, or Sap? What do you think?","Warm calm kindergarten teacher voice. Natural pacing. Brief pause between each answer choice."
kindergarten/RF.K.2e,RF.K.2e-Q5,"Add the sss sound to the beginning of Top. What word do you get? Spot, Stop, Step, or Tops? What do you think?","Warm calm kindergarten teacher voice. Natural pacing. Brief pause between each answer choice."
