"lesson_id","filename","script_text","voice_direction"
"lessons/RF.4.3a","S1a","In long words, look for letter-sound combos you already know.",""
"lessons/RF.4.3a","S2a","PH says F. GH can be silent. CH can sound like K in some words.",""
"lessons/RF.4.3a","S3a","Vowel combos like EA, EE, OA, OU show up everywhere.",""
"lessons/RF.4.3a","S4a","Here is a helpful trick.",""
"lessons/RF.4.3a","S4b","When decoding, scan for known combos first. They are anchor points.",""
"lessons/RF.4.3a","S4c","Now you are ready for letter-sound combos!",""
