lesson_id,filename,script_text,voice_direction
lessons/RF.K.3b,S3sl-a,"Vowels can make two sounds: a short sound and a long sound.","Warm calm kindergarten teacher voice. Natural pacing."
lessons/RF.K.3b,S3sl-b,"The short A sound. Like in cat.","Warm calm kindergarten teacher voice. Natural pacing."
lessons/RF.K.3b,S3sl-c,"The long A sound. Like in cake. The long sound says its name!","Warm calm kindergarten teacher voice. Natural pacing."
lessons/RF.K.3b,S3sl-d,"Hear the difference? Cat. Cake. Short A and long A.","Warm calm kindergarten teacher voice. Natural pacing."
lessons/RF.K.3b,S4me-a,"Here is a magic trick called Magic E.","Warm calm kindergarten teacher voice. Natural pacing."
lessons/RF.K.3b,S4me-b,"Add an E to the end of cat. Cat becomes cake. The E is silent, but it makes the A say its name!","Warm calm kindergarten teacher voice. Natural pacing."
lessons/RF.K.3b,S4me-c,"That is Magic E. Silent at the end, but it changes the vowel sound!","Warm calm kindergarten teacher voice. Natural pacing."
