lesson_id,filename,script_text,voice_direction
lessons/RI.K.6,Sill-a,"Look at this book about jungle animals. Who drew the pictures?","Warm, curious teacher voice."
lessons/RI.K.6,Sill-b,"Right there on the cover — pictures by Leo Bright! That's the illustrator's name.","Warm teacher voice. Pronounce 'Leo Bright' clearly."
lessons/RI.K.6,Sill-c,"Leo drew lions, tigers, and monkeys so we could see the jungle animals!","Warm, encouraging teacher voice. Slight emphasis on the animal names."
lessons/RI.K.6,S4a,"When you read a fact book, ask yourself three questions!","Warm inviting teacher voice. Emphasize 'three questions'."
lessons/RI.K.6,S4c-ill,"Next ask: Who drew the pictures? That tells you the ILLUSTRATOR!","Clear teacher voice, emphasize 'Who drew the pictures' and 'ILLUSTRATOR'."
lessons/RI.K.6,S4d,"Last ask: What are they teaching me? That's the MESSAGE!","Clear teacher voice, emphasize 'What are they teaching' and 'MESSAGE'."
lessons/RI.K.6,S4e,"Those three questions help you understand any fact book!","Cheerful, encouraging wrap-up."
lessons/RI.K.6,S5a,"You're awesome at finding authors, illustrators, and their messages!","Cheerful, celebratory. Clear pronunciation of 'illustrators'."
lessons/RI.K.6,S5b,"Let's practice figuring out who wrote the book, who drew the pictures, and what they want us to learn!","Encouraging teacher voice, slight pauses between the three items."
