"lesson_id","filename","script_text","voice_direction"
"1st-grade/RF.1.3e","RF.1.3e-Q5","Break the word basket into syllables. ba-sket. bask-et. basket-. bas-ket.",""
"1st-grade/RF.1.3f","RF.1.3f-Q1","What does the -s at the end of cats mean? more than one. it happened before. it is happening now. it is very small.",""
"1st-grade/RF.1.3f","RF.1.3f-Q2","What ending means ""happening right now""? -ed. -ing. -s. -er.",""
"1st-grade/RF.1.3f","RF.1.3f-Q3","Jumped has which ending? -ing. -s. -ed. -ly.",""
"1st-grade/RF.1.3f","RF.1.3f-Q4","What is the root word in playing? playi. ing. plays. play.",""
"1st-grade/RF.1.3f","RF.1.3f-Q5","Add -ed to walk. What word do you get? walked. walks. walking. walker.",""
"1st-grade/RF.1.3g","RF.1.3g-Q1","The word said is tricky. How is it spelled? s-e-d. s-a-i-d. s-a-d. s-i-d.",""
"1st-grade/RF.1.3g","RF.1.3g-Q2","Which tricky word means ""in the past""? is. now. was. do.",""
"1st-grade/RF.1.3g","RF.1.3g-Q3","How is the tricky word have spelled? h-a-v. h-a-f. h-a-p-e. h-a-v-e.",""
"1st-grade/RF.1.3g","RF.1.3g-Q4","Which tricky word means ""more than one person was""? were. was. are. is.",""
"1st-grade/RF.1.3g","RF.1.3g-Q5","Why are words like said and have called tricky? They have too many letters. You cannot sound them out. They are very long. They mean nothing.",""
"1st-grade/RF.1.4a","RF.1.4a-Q1","Why might you read a storybook? to find your lost toy. to buy groceries. for fun. to build a house.",""
"1st-grade/RF.1.4a","RF.1.4a-Q2","Why might you read a book about sharks? to cook dinner. to go to bed. to brush teeth. to learn about sharks.",""
"1st-grade/RF.1.4a","RF.1.4a-Q3","Before you start reading, a smart reader asks: Why am I reading this?. What time is it?. What is for dinner?. Is it cold outside?.",""
"1st-grade/RF.1.4a","RF.1.4a-Q4","Reading with purpose means: reading as fast as possible. knowing why you are reading. skipping every other word. closing your eyes.",""
"1st-grade/RF.1.4a","RF.1.4a-Q5","You want to find out how butterflies fly. Which book is best? a storybook about pirates. a cookbook. a fact book about butterflies. a song book.",""
"1st-grade/RL.1.10","RL.1.10-Q1","Why is it important to read lots of different stories? It makes you taller. It makes you loud. It makes you tired. It makes your brain stronger.",""
"1st-grade/RL.1.10","RL.1.10-Q2","Which is a great way to get better at reading? read a little every day. read only once a month. never read. read only one book over and over.",""
"1st-grade/RL.1.10","RL.1.10-Q3","What should you do when a story gets tricky? give up forever. ask for help. skip every page. close the book and never open it.",""
"1st-grade/RL.1.10","RL.1.10-Q4","A poem is a special kind of: toy. food. story or writing. song on the radio.",""
"1st-grade/RL.1.10","RL.1.10-Q5","Why try stories that are a little harder than before? to show off. to get tired quickly. to skip reading. to grow as a reader.",""
"1st-grade/RI.1.10","RI.1.10-Q1","Fact books teach you about: the real world. dragons and magic. your dreams. made-up animals.",""
"1st-grade/RI.1.10","RI.1.10-Q2","You love bugs! Which fact book should you pick? a cookbook. a book about insects. a storybook about pirates. a song book.",""
"1st-grade/RI.1.10","RI.1.10-Q3","What is a good way to find facts in a book? close your eyes. eat a snack. look at headings and pictures. skip every page.",""
"1st-grade/RI.1.10","RI.1.10-Q4","Why might a fact book have tricky words? to trick you. to slow you down. to make you quit. it teaches new words.",""
"1st-grade/RI.1.10","RI.1.10-Q5","Reading lots of different fact books helps you: learn about the world. run faster. grow taller. make loud noises.",""
"1st-grade/L.1.1","L.1.1-Q1","Which word is a noun (a thing or person)? jumps. dog. fast. happily.",""
"1st-grade/L.1.1","L.1.1-Q2","Which word is a verb (an action)? cat. red. runs. tree.",""
"1st-grade/L.1.1","L.1.1-Q3","Which word fits: ""I ___ happy today."" is. are. be. am.",""
"1st-grade/L.1.1","L.1.1-Q4","Pick the right word: ""She ___ to school."" walks. walk. walked. walking.",""
"1st-grade/L.1.1","L.1.1-Q5","Which word is an adjective (describes a thing)? cat. fluffy. jumps. quickly.",""
"1st-grade/L.1.2","L.1.2-Q1","Which sentence is written correctly? the dog runs fast.. The dog runs fast. The dog runs fast.. the dog runs fast.",""
"1st-grade/L.1.2","L.1.2-Q2","What does every sentence need at the end? a number. a color. a letter. a mark like . ? or !.",""
"1st-grade/L.1.2","L.1.2-Q3","Which name is written correctly? Maya. maya. MAYA. mAyA.",""
"1st-grade/L.1.2","L.1.2-Q4","What ending mark do you use for a question? .. ?. !. ,.",""
"1st-grade/L.1.2","L.1.2-Q5","Fix this: ben and maya play. What is wrong? It needs a number. It has too many words. Names need capitals. Nothing is wrong.",""
