"lesson_id","filename","script_text","voice_direction"
"lessons/RL.3.10","S1a","Third graders read stories and poems all year.",""
"lessons/RL.3.10","S1b","Your reading gets stronger with every book.",""
"lessons/RL.3.10","S2a","Mix stories. Short ones, long ones, adventures, poems, and plays.",""
"lessons/RL.3.10","S2b","Different kinds stretch your brain differently.",""
"lessons/RL.3.10","S3a","A stretch book is a little hard. That is good!",""
"lessons/RL.3.10","S3b","When stuck, ask a grown-up or reread slowly.",""
"lessons/RL.3.10","S4a","Here is a helpful trick.",""
"lessons/RL.3.10","S4b","Pick a daily reading time. Even fifteen minutes adds up over a year!",""
"lessons/RL.3.10","S4c","Now you are ready to read stories all year!",""
