"lesson_id","filename","script_text","voice_direction"
"lessons/RF.2.4","S1a","Great readers read smoothly, like talking.",""
"lessons/RF.2.4","S1b","Fluency is reading accurately, at the right speed, with expression.",""
"lessons/RF.2.4","S2a","Accuracy means reading the words correctly.",""
"lessons/RF.2.4","S2b","If you get stuck, slow down and sound it out.",""
"lessons/RF.2.4","S3a","Rate is how fast. Not too fast, not too slow.",""
"lessons/RF.2.4","S3b","Expression means using your voice to match the story.",""
"lessons/RF.2.4","S4a","Here is a helpful trick.",""
"lessons/RF.2.4","S4b","Pretend you are telling the story to a friend. Use your normal voice!",""
"lessons/RF.2.4","S4c","Now you are ready to read with flow!",""
