"lesson_id","filename","script_text","voice_direction"
"lessons/L.4.4c","S1a","Dictionaries, thesauri, and glossaries each help differently.",""
"lessons/L.4.4c","S2a","A dictionary gives meaning, sound, and how to use the word.",""
"lessons/L.4.4c","S3a","A thesaurus gives synonyms — words with similar meanings.",""
"lessons/L.4.4c","S4a","Here is a helpful trick.",""
"lessons/L.4.4c","S4b","Need a meaning? Dictionary. Need a different word? Thesaurus.",""
"lessons/L.4.4c","S4c","Now you are ready to use reference materials!",""
