lesson_id,filename,script_text,voice_direction
lessons/RF.K.3a,S2a,"Look at the letter ess. It hisses like a snake.","Warm calm kindergarten teacher voice. Natural pacing."
lessons/RF.K.3a,S2b,"The letter em. Like something yummy.","Warm calm kindergarten teacher voice. Natural pacing."
lessons/RF.K.3a,S2c,"The letter tee. Like a ticking clock.","Warm calm kindergarten teacher voice. Natural pacing."
lessons/RF.K.3a,S3b,"Look at the letter bee. What sound does bee make?","Warm calm kindergarten teacher voice. Natural pacing."
lessons/RF.K.3a,S3c,"Now the letters dee and eff. Listen to each sound.","Warm calm kindergarten teacher voice. Natural pacing."
