"lesson_id","filename","script_text","voice_direction"
"lessons/L.4.6","S1a","Knowing big words helps. Using them helps even more.",""
"lessons/L.4.6","S2a","Try new words in your speaking and writing.",""
"lessons/L.4.6","S2b","They become yours after you use them.",""
"lessons/L.4.6","S3a","Casual for chats. Academic for school.",""
"lessons/L.4.6","S4a","Here is a helpful trick.",""
"lessons/L.4.6","S4b","One new word a day. Use it three times!",""
"lessons/L.4.6","S4c","Now you are ready to use big vocabulary!",""
